[
  {
    "event_id": "10000000-0000-4000-8000-000000000001",
    "school_id": "20000000-0000-4000-8000-000000000001",
    "actor_id": "30000000-0000-4000-8000-000000000001",
    "aggregate_id": "40000000-0000-4000-8000-000000000001",
    "aggregate_revision": 1,
    "schema_version": 1,
    "occurred_at": "2026-10-15T08:00:00Z",
    "received_at": "2026-10-15T08:00:00Z",
    "source": "server",
    "type": "assignment.created",
    "payload": {
      "assignment_id": "50000000-0000-4000-8000-000000000001",
      "lesson_version_id": "50000000-0000-4000-8000-000000000002"
    }
  },
  {
    "event_id": "10000000-0000-4000-8000-000000000002",
    "school_id": "20000000-0000-4000-8000-000000000001",
    "actor_id": "30000000-0000-4000-8000-000000000001",
    "aggregate_id": "40000000-0000-4000-8000-000000000001",
    "aggregate_revision": 1,
    "schema_version": 1,
    "occurred_at": "2026-10-15T08:00:00Z",
    "received_at": "2026-10-15T08:00:00Z",
    "source": "server",
    "type": "lesson.completed",
    "payload": {
      "assignment_enrollment_id": "50000000-0000-4000-8000-000000000001",
      "lesson_version_id": "50000000-0000-4000-8000-000000000002"
    }
  },
  {
    "event_id": "10000000-0000-4000-8000-000000000003",
    "school_id": "20000000-0000-4000-8000-000000000001",
    "actor_id": "30000000-0000-4000-8000-000000000001",
    "aggregate_id": "40000000-0000-4000-8000-000000000001",
    "aggregate_revision": 1,
    "schema_version": 1,
    "occurred_at": "2026-10-15T08:00:00Z",
    "received_at": "2026-10-15T08:00:00Z",
    "source": "server",
    "type": "assessment.submitted",
    "payload": {
      "attempt_id": "50000000-0000-4000-8000-000000000001",
      "submission_version_id": "50000000-0000-4000-8000-000000000002",
      "assessment_version_id": "50000000-0000-4000-8000-000000000003"
    }
  },
  {
    "event_id": "10000000-0000-4000-8000-000000000004",
    "school_id": "20000000-0000-4000-8000-000000000001",
    "actor_id": "30000000-0000-4000-8000-000000000001",
    "aggregate_id": "40000000-0000-4000-8000-000000000001",
    "aggregate_revision": 1,
    "schema_version": 1,
    "occurred_at": "2026-10-15T08:00:00Z",
    "received_at": "2026-10-15T08:00:00Z",
    "source": "server",
    "type": "marking.completed",
    "payload": {
      "submission_version_id": "50000000-0000-4000-8000-000000000001",
      "marking_round_id": "50000000-0000-4000-8000-000000000002"
    }
  },
  {
    "event_id": "10000000-0000-4000-8000-000000000005",
    "school_id": "20000000-0000-4000-8000-000000000001",
    "actor_id": "30000000-0000-4000-8000-000000000001",
    "aggregate_id": "40000000-0000-4000-8000-000000000001",
    "aggregate_revision": 1,
    "schema_version": 1,
    "occurred_at": "2026-10-15T08:00:00Z",
    "received_at": "2026-10-15T08:00:00Z",
    "source": "server",
    "type": "moderation.recorded",
    "payload": {
      "marking_round_id": "50000000-0000-4000-8000-000000000001",
      "moderation_record_id": "50000000-0000-4000-8000-000000000002"
    }
  },
  {
    "event_id": "10000000-0000-4000-8000-000000000006",
    "school_id": "20000000-0000-4000-8000-000000000001",
    "actor_id": "30000000-0000-4000-8000-000000000001",
    "aggregate_id": "40000000-0000-4000-8000-000000000001",
    "aggregate_revision": 1,
    "schema_version": 1,
    "occurred_at": "2026-10-15T08:00:00Z",
    "received_at": "2026-10-15T08:00:00Z",
    "source": "server",
    "type": "result.released",
    "payload": {
      "submission_version_id": "50000000-0000-4000-8000-000000000001",
      "release_id": "50000000-0000-4000-8000-000000000002",
      "marking_round_id": "50000000-0000-4000-8000-000000000003"
    }
  },
  {
    "event_id": "10000000-0000-4000-8000-000000000007",
    "school_id": "20000000-0000-4000-8000-000000000001",
    "actor_id": "30000000-0000-4000-8000-000000000001",
    "aggregate_id": "40000000-0000-4000-8000-000000000001",
    "aggregate_revision": 1,
    "schema_version": 1,
    "occurred_at": "2026-10-15T08:00:00Z",
    "received_at": "2026-10-15T08:00:00Z",
    "source": "server",
    "type": "result.corrected",
    "payload": {
      "previous_release_id": "50000000-0000-4000-8000-000000000001",
      "release_id": "50000000-0000-4000-8000-000000000002",
      "submission_version_id": "50000000-0000-4000-8000-000000000003"
    }
  },
  {
    "event_id": "10000000-0000-4000-8000-000000000008",
    "school_id": "20000000-0000-4000-8000-000000000001",
    "actor_id": "30000000-0000-4000-8000-000000000001",
    "aggregate_id": "40000000-0000-4000-8000-000000000001",
    "aggregate_revision": 1,
    "schema_version": 1,
    "occurred_at": "2026-10-15T08:00:00Z",
    "received_at": "2026-10-15T08:00:00Z",
    "source": "server",
    "type": "feedback.reviewed",
    "payload": {
      "release_id": "50000000-0000-4000-8000-000000000001"
    }
  },
  {
    "event_id": "10000000-0000-4000-8000-000000000009",
    "school_id": "20000000-0000-4000-8000-000000000001",
    "actor_id": "30000000-0000-4000-8000-000000000001",
    "aggregate_id": "40000000-0000-4000-8000-000000000001",
    "aggregate_revision": 1,
    "schema_version": 1,
    "occurred_at": "2026-10-15T08:00:00Z",
    "received_at": "2026-10-15T08:00:00Z",
    "source": "server",
    "type": "intervention.recorded",
    "payload": {
      "intervention_id": "50000000-0000-4000-8000-000000000001",
      "enrollment_id": "50000000-0000-4000-8000-000000000002"
    }
  },
  {
    "event_id": "10000000-0000-4000-8000-000000000010",
    "school_id": "20000000-0000-4000-8000-000000000001",
    "actor_id": "30000000-0000-4000-8000-000000000001",
    "aggregate_id": "40000000-0000-4000-8000-000000000001",
    "aggregate_revision": 1,
    "schema_version": 1,
    "occurred_at": "2026-10-15T08:00:00Z",
    "received_at": "2026-10-15T08:00:00Z",
    "source": "server",
    "type": "curriculum.delivery_recorded",
    "payload": {
      "delivery_record_id": "40000000-0000-4000-8000-000000000001",
      "assignment_id": "50000000-0000-4000-8000-000000000001"
    }
  },
  {
    "event_id": "10000000-0000-4000-8000-000000000011",
    "school_id": "20000000-0000-4000-8000-000000000001",
    "actor_id": "30000000-0000-4000-8000-000000000001",
    "aggregate_id": "40000000-0000-4000-8000-000000000001",
    "aggregate_revision": 1,
    "schema_version": 1,
    "occurred_at": "2026-10-15T08:00:00Z",
    "received_at": "2026-10-15T08:00:00Z",
    "source": "server",
    "type": "activity.draft_saved",
    "payload": {
      "assignment_enrollment_id": "40000000-0000-4000-8000-000000000001",
      "item_id": "40000000-0000-4000-8000-000000000001"
    }
  },
  {
    "event_id": "10000000-0000-4000-8000-000000000012",
    "school_id": "20000000-0000-4000-8000-000000000001",
    "actor_id": "30000000-0000-4000-8000-000000000001",
    "aggregate_id": "40000000-0000-4000-8000-000000000001",
    "aggregate_revision": 1,
    "schema_version": 1,
    "occurred_at": "2026-10-15T08:00:00Z",
    "received_at": "2026-10-15T08:00:00Z",
    "source": "server",
    "type": "activity.draft_cleared",
    "payload": {
      "assignment_enrollment_id": "40000000-0000-4000-8000-000000000001",
      "item_id": "40000000-0000-4000-8000-000000000001"
    }
  },
  {
    "event_id": "10000000-0000-4000-8000-000000000013",
    "school_id": "20000000-0000-4000-8000-000000000001",
    "actor_id": "30000000-0000-4000-8000-000000000001",
    "aggregate_id": "40000000-0000-4000-8000-000000000001",
    "aggregate_revision": 1,
    "schema_version": 1,
    "occurred_at": "2026-10-15T08:00:00Z",
    "received_at": "2026-10-15T08:00:00Z",
    "source": "server",
    "type": "assessment.attempt_created",
    "payload": {
      "attempt_id": "40000000-0000-4000-8000-000000000001",
      "assessment_version_id": "40000000-0000-4000-8000-000000000001"
    }
  },
  {
    "event_id": "10000000-0000-4000-8000-000000000014",
    "school_id": "20000000-0000-4000-8000-000000000001",
    "actor_id": "30000000-0000-4000-8000-000000000001",
    "aggregate_id": "40000000-0000-4000-8000-000000000001",
    "aggregate_revision": 1,
    "schema_version": 1,
    "occurred_at": "2026-10-15T08:00:00Z",
    "received_at": "2026-10-15T08:00:00Z",
    "source": "server",
    "type": "assessment.response_saved",
    "payload": {
      "attempt_id": "40000000-0000-4000-8000-000000000001",
      "item_id": "40000000-0000-4000-8000-000000000001"
    }
  },
  {
    "event_id": "10000000-0000-4000-8000-000000000015",
    "school_id": "20000000-0000-4000-8000-000000000001",
    "actor_id": "30000000-0000-4000-8000-000000000001",
    "aggregate_id": "40000000-0000-4000-8000-000000000001",
    "aggregate_revision": 1,
    "schema_version": 1,
    "occurred_at": "2026-10-15T08:00:00Z",
    "received_at": "2026-10-15T08:00:00Z",
    "source": "server",
    "type": "marking.round_created",
    "payload": {
      "submission_version_id": "40000000-0000-4000-8000-000000000001",
      "marking_round_id": "40000000-0000-4000-8000-000000000001"
    }
  },
  {
    "event_id": "10000000-0000-4000-8000-000000000016",
    "school_id": "20000000-0000-4000-8000-000000000001",
    "actor_id": "30000000-0000-4000-8000-000000000001",
    "aggregate_id": "40000000-0000-4000-8000-000000000001",
    "aggregate_revision": 1,
    "schema_version": 1,
    "occurred_at": "2026-10-15T08:00:00Z",
    "received_at": "2026-10-15T08:00:00Z",
    "source": "server",
    "type": "academic.review_requested",
    "payload": {
      "review_request_id": "40000000-0000-4000-8000-000000000001",
      "release_id": "40000000-0000-4000-8000-000000000001"
    }
  },
  {
    "event_id": "10000000-0000-4000-8000-000000000017",
    "school_id": "20000000-0000-4000-8000-000000000001",
    "actor_id": "30000000-0000-4000-8000-000000000001",
    "aggregate_id": "40000000-0000-4000-8000-000000000001",
    "aggregate_revision": 1,
    "schema_version": 1,
    "occurred_at": "2026-10-15T08:00:00Z",
    "received_at": "2026-10-15T08:00:00Z",